<?xml version="1.0" encoding="UTF-8"?>
<!-- Include entities to be used in the xml -->
<!DOCTYPE section [
	<!ENTITY rarr "&#x2192;">
	<!ENTITY lol "&#x1F923;">
]>

<Section folder="Entrees/Oven" xmlns:xsi="http://www.w3.org/2001/XMLSchema-instance" xsi:noNamespaceSchemaLocation="../../section.xsd">
	<Name>Oven</Name>
	<Summary xmlns:xsi="http://www.w3.org/2001/XMLSchema-instance" xsi:noNamespaceSchemaLocation="../../summary.xsd">
		For a lot of Entrees, cooking them in an Oven yields the best results.
	</Summary>
	<Pages>
		<page href="Pizza.xml">Pizza</page>
		<page href="ShepherdsPie.xml">Shepherd's Pie</page>
		<page href="EasyEnchiladas.xml">Easy Enchiladas</page>
		<page href="PerfectPrimeRib.xml">Perfect Prime Rib</page>
		<page href="BBQRibsToDiFor.xml">BBQ Ribs to Di For</page>
		<page class="qzxDisabled TODO" href="GF_PizzaCrust.xml">Gluten-Free Pizza Crust</page>
		<page href="CrossroadsRice.xml">
			Crossroads Rice Casserole
			<Simple>Chicken and Rice Casserole</Simple>
			<Note>Get it? Crossroads &rarr; Cross the road? Chicken? &lol;</Note>
		</page>
	</Pages>
</Section>
