<?xml version="1.0" encoding="UTF-8"?>
<!-- Include entities to be used in the xml -->
<!DOCTYPE section>

<Section folder="Sides" xmlns:xsi="http://www.w3.org/2001/XMLSchema-instance" xsi:noNamespaceSchemaLocation="../section.xsd">
	<Name>Side Dishes</Name>
	<Summary xmlns:xsi="http://www.w3.org/2001/XMLSchema-instance" xsi:noNamespaceSchemaLocation="../summary.xsd">
		Part of every meal are the things you serve beside the entree.
		For a really good meal, you will probably need to use one or two of the recipes in this section.
	</Summary>
	<Pages>
		<page href="MashedPotatoes.xml">Mashed Potatoes</page>
		<page href="Rice.xml">Rice</page>
		<page href="LehiRice.xml">Lehi Rice</page>
		<page href="DutchSpanishRice.xml">Dutch Spanish Rice</page>
		<page href="FriedRice.xml">Fried Rice</page>
		<page href="Stuff(Me)ing.xml">Stuff<span class="SMALL_NOTE">(Me)</span>ing</page>
		<page href="GreenBeanCasserole.xml">Green Bean Casserole</page>
		<page href="GarlicGingerStirFryGreenBeans.xml">Garlic-Ginger Stir-Fry Green Beans</page>
		<page href="EasyPotatoesAuGratin.xml">Easy Potatoes Au Gratin</page>
		<page href="RedheadCarrots.xml">Redhead Carrots</page>
		<page href="ComfortRice.xml">Mexican Rice of Comfort</page>
		<page class="qzxDisabled TODO" href="ComfortBeans.xml">Mexican Beans of Comfort</page>
		<page class="qzxDisabled TODO" href="CranberryJelloSalad.xml">Cranberry Jello Salad</page>
		<page class="qzxDisabled TODO" href="SheetPanVeggies.xml">Sheet Pan Veggies</page>
	</Pages>
</Section>
